{
  "eventId": "10000000-0000-4000-8000-000000000001",
  "eventType": "MovementRequested.v1",
  "schemaVersion": 1,
  "occurredAt": "2026-09-08T00:00:00Z",
  "siteId": "site-a",
  "source": "legacy-core",
  "aggregateType": "movement",
  "aggregateId": "20000000-0000-4000-8000-000000000002",
  "aggregateVersion": 1,
  "correlationId": "30000000-0000-4000-8000-000000000003",
  "causationId": null,
  "traceparent": null,
  "payload": {
    "movementId": "20000000-0000-4000-8000-000000000002",
    "reservationId": "20000000-0000-4000-8000-000000000002",
    "siteId": "site-a",
    "product": "fulfilment",
    "zoneId": "ambient",
    "loadId": "40000000-0000-4000-8000-000000000004",
    "source": "ambient-bin-001",
    "destination": "outbound-staging",
    "quantity": 1,
    "priority": 5,
    "eligibleAt": "2026-09-08T00:00:00Z"
  }
}
